{"$schema":"https://json-schema.org/draft/2020-12/schema","$id":"https://github.com/theb0yys/FOA-SDK/blob/main/Installer/SuiteWizard/Resolver/plan.schema.json","title":"FOA-SDK deterministic installer resolution plan","type":"object","additionalProperties":false,"required":["schema_version","suite","context","selection","policies","requires_elevation","package_order","packages","summary","warnings","plan_sha256"],"properties":{"schema_version":{"const":1},"suite":{"type":"object","additionalProperties":false,"required":["suite_id","display_name","version","channel","manifest_sha256"],"properties":{"suite_id":{"$ref":"#/$defs/namespaced_id"},"display_name":{"type":"string","minLength":1,"maxLength":160},"version":{"$ref":"#/$defs/semantic_version"},"channel":{"type":"string","minLength":1,"maxLength":64},"manifest_sha256":{"$ref":"#/$defs/sha256"}}},"context":{"type":"object","additionalProperties":false,"required":["platform","architecture","runtime_target","game_version","branch"],"properties":{"platform":{"type":"string","minLength":1,"maxLength":64},"architecture":{"type":"string","minLength":1,"maxLength":64},"runtime_target":{"type":"string","minLength":1,"maxLength":64},"game_version":{"type":"string","maxLength":128},"branch":{"type":"string","maxLength":128}}},"selection":{"type":"object","additionalProperties":false,"required":["selected_package_ids","excluded_package_ids","selected_feature_ids"],"properties":{"selected_package_ids":{"$ref":"#/$defs/id_array"},"excluded_package_ids":{"$ref":"#/$defs/id_array"},"selected_feature_ids":{"$ref":"#/$defs/id_array"}}},"policies":{"type":"object","additionalProperties":false,"required":["network_allowed","elevation_allowed","unreviewed_packages_allowed","silent_install_allowed"],"properties":{"network_allowed":{"type":"boolean"},"elevation_allowed":{"type":"boolean"},"unreviewed_packages_allowed":{"const":false},"silent_install_allowed":{"type":"boolean"}}},"requires_elevation":{"type":"boolean"},"package_order":{"$ref":"#/$defs/id_array"},"packages":{"type":"array","maxItems":256,"items":{"type":"object","additionalProperties":false,"required":["package_id","display_name","version","kind","status","selection_reasons","dependency_ids","capabilities","manifest_sha256","source","lifecycle","legal","payload"],"properties":{"package_id":{"$ref":"#/$defs/namespaced_id"},"display_name":{"type":"string","minLength":1,"maxLength":160},"version":{"$ref":"#/$defs/semantic_version"},"kind":{"type":"string","minLength":1,"maxLength":64},"status":{"type":"string","minLength":1,"maxLength":64},"selection_reasons":{"type":"array","uniqueItems":true,"items":{"type":"string","minLength":1,"maxLength":256}},"dependency_ids":{"$ref":"#/$defs/id_array"},"capabilities":{"type":"array","uniqueItems":true,"items":{"type":"string","minLength":1,"maxLength":128}},"manifest_sha256":{"$ref":"#/$defs/sha256"},"source":{"type":"object","additionalProperties":false,"required":["kind","repository","commit","path"],"properties":{"kind":{"type":"string","minLength":1,"maxLength":64},"repository":{"type":"string","format":"uri","maxLength":512},"commit":{"type":"string","pattern":"^[0-9a-f]{40}$"},"path":{"$ref":"#/$defs/relative_path"},"fingerprint_sha256":{"$ref":"#/$defs/sha256"}}},"lifecycle":{"type":"object","additionalProperties":false,"required":["install_scope","elevation_required","repair_supported","upgrade_supported","uninstall_supported","rollback_required","preserve_external_workspaces"],"properties":{"install_scope":{"type":"string","minLength":1,"maxLength":64},"elevation_required":{"type":"boolean"},"repair_supported":{"type":"boolean"},"upgrade_supported":{"type":"boolean"},"uninstall_supported":{"type":"boolean"},"rollback_required":{"type":"boolean"},"preserve_external_workspaces":{"const":true}}},"legal":{"type":"object","additionalProperties":false,"required":["license_expression","redistribution_review","notice_files"],"properties":{"license_expression":{"type":"string","minLength":1,"maxLength":256},"redistribution_review":{"enum":["approved","not-applicable"]},"notice_files":{"type":"array","uniqueItems":true,"items":{"$ref":"#/$defs/relative_path"}}}},"payload":{"type":"array","maxItems":100000,"items":{"type":"object","additionalProperties":false,"required":["source","destination","sha256","size_bytes","redistribution"],"properties":{"source":{"$ref":"#/$defs/relative_path"},"destination":{"$ref":"#/$defs/relative_path"},"sha256":{"$ref":"#/$defs/sha256"},"size_bytes":{"type":"integer","minimum":0,"maximum":1099511627776},"redistribution":{"enum":["project-owned","approved","notice-required"]}}}}}}},"summary":{"type":"object","additionalProperties":false,"required":["package_count","payload_file_count","payload_size_bytes"],"properties":{"package_count":{"type":"integer","minimum":0,"maximum":256},"payload_file_count":{"type":"integer","minimum":0},"payload_size_bytes":{"type":"integer","minimum":0}}},"warnings":{"type":"array","uniqueItems":true,"items":{"type":"string","minLength":1,"maxLength":512}},"plan_sha256":{"$ref":"#/$defs/sha256"}},"$defs":{"semantic_version":{"type":"string","pattern":"^(0|[1-9][0-9]*)\\.(0|[1-9][0-9]*)\\.(0|[1-9][0-9]*)(?:-[0-9A-Za-z.-]+)?(?:\\+[0-9A-Za-z.-]+)?$","maxLength":128},"namespaced_id":{"type":"string","pattern":"^[a-z][a-z0-9]*(?:[.-][a-z0-9]+)+$","maxLength":128},"sha256":{"type":"string","pattern":"^[0-9a-f]{64}$"},"relative_path":{"type":"string","pattern":"^(?!/)(?!.*(?:^|/)\\.\\.(?:/|$))(?!.*\\\\)(?!.*//)[^\\u0000-\\u001f\\u007f]+$","maxLength":1024},"id_array":{"type":"array","uniqueItems":true,"items":{"$ref":"#/$defs/namespaced_id"}}}}
