{"context":{"architecture":"x86_64","branch":"","game_version":"","platform":"windows","runtime_target":"editor-only"},"package_order":["foa.foundation-descriptor","foa.editor-descriptor","foa.installer-documentation"],"packages":[{"capabilities":["authoring.read","catalog.foundation.inspect"],"dependency_ids":[],"display_name":"FOA-SDK Foundation Descriptor","kind":"core-foundation","legal":{"license_expression":"Apache-2.0 OR MIT","notice_files":[],"redistribution_review":"approved"},"lifecycle":{"elevation_required":false,"install_scope":"per-user","preserve_external_workspaces":true,"repair_supported":true,"rollback_required":true,"uninstall_supported":true,"upgrade_supported":true},"manifest_sha256":"cee7a71d8a7c2edff89623dce955503b6705e9f98a3cfe6b365e5c4692f11c1f","package_id":"foa.foundation-descriptor","payload":[{"destination":"FOA-SDK/Gems/TaintedGrailModdingSDK/gem.json","redistribution":"project-owned","sha256":"324a4adf3b2209a35b61400438410c70a019318a30d79fa5128b0f2aad1e7ecd","size_bytes":679,"source":"gem.json"}],"selection_reasons":["dependency:foa.editor-descriptor","suite:required"],"source":{"commit":"e7cec6515c9e5ac4e64c8ee3eea5dd5b769121d1","kind":"product","path":"Gems/TaintedGrailModdingSDK","repository":"https://github.com/theb0yys/FOA-SDK"},"status":"preview","version":"0.1.0"},{"capabilities":["authoring.read","catalog.editor.inspect"],"dependency_ids":["foa.foundation-descriptor"],"display_name":"FOA-SDK Editor Project Descriptor","kind":"editor-project","legal":{"license_expression":"Apache-2.0 OR MIT","notice_files":[],"redistribution_review":"approved"},"lifecycle":{"elevation_required":false,"install_scope":"per-user","preserve_external_workspaces":true,"repair_supported":true,"rollback_required":true,"uninstall_supported":true,"upgrade_supported":true},"manifest_sha256":"07d210e2156cc95cbef461d912fcb026da5e3fa24fd22c5e334c3fa9de83686a","package_id":"foa.editor-descriptor","payload":[{"destination":"FOA-SDK/TaintedGrailModdingEditor/project.json","redistribution":"project-owned","sha256":"7173e387575578edd7270374b423f5738dd82d6102aa0e8fe341955c75e257e8","size_bytes":1032,"source":"project.json"}],"selection_reasons":["suite:default"],"source":{"commit":"e7cec6515c9e5ac4e64c8ee3eea5dd5b769121d1","kind":"product","path":"TaintedGrailModdingEditor","repository":"https://github.com/theb0yys/FOA-SDK"},"status":"preview","version":"0.1.0"},{"capabilities":["documentation.read"],"dependency_ids":[],"display_name":"FOA-SDK Installer Suite Documentation","kind":"documentation","legal":{"license_expression":"Apache-2.0 OR MIT","notice_files":[],"redistribution_review":"approved"},"lifecycle":{"elevation_required":false,"install_scope":"per-user","preserve_external_workspaces":true,"repair_supported":true,"rollback_required":true,"uninstall_supported":true,"upgrade_supported":true},"manifest_sha256":"ec361f8048c26eab138b5f024c5590d24ba21e12014f12ab06dc2051fef9ce1d","package_id":"foa.installer-documentation","payload":[{"destination":"FOA-SDK/Documentation/INSTALLER_SUITES.md","redistribution":"project-owned","sha256":"ae53f47506fadec71285f6566b49a61a91c0fe0a12c44f02703ef675d4213f89","size_bytes":581,"source":"README.md"}],"selection_reasons":["feature:foa.feature.documentation"],"source":{"commit":"e7cec6515c9e5ac4e64c8ee3eea5dd5b769121d1","kind":"product","path":"Installer/Suites","repository":"https://github.com/theb0yys/FOA-SDK"},"status":"preview","version":"0.1.0"}],"plan_sha256":"5275a5e7947ec8c9deb382f2e0e68ee80308ce166516cccfb69664529a2dc1b7","policies":{"elevation_allowed":false,"network_allowed":false,"silent_install_allowed":false,"unreviewed_packages_allowed":false},"requires_elevation":false,"schema_version":1,"selection":{"excluded_package_ids":[],"selected_feature_ids":["foa.feature.documentation"],"selected_package_ids":[]},"suite":{"channel":"development","display_name":"FOA-SDK Developer Preview","manifest_sha256":"5f969c035e13e59007d71698ba1a0bf47ad971c351f317c65a2a1455d08a49f6","suite_id":"foa.developer-preview","version":"0.1.0"},"summary":{"package_count":3,"payload_file_count":3,"payload_size_bytes":2292},"warnings":[]}
